-- Name: Sumedha Zaware
--Assignment-2

-- Create Account table
mysql> create table Account(Acc_no int, branch_name varchar(10), balance int);
Query OK, 0 rows affected (1.74 sec)

-- Insert values into Account table
mysql> insert into Account(Acc_no, branch_name,balance)
    -> values(101,'Wakad',90000),
    -> (102,'Akurdi',60000),
    -> (103,'Nigdi',50000),
    -> (104,'Ravet',70000),
    -> (105,'Pimpri',80000);
Query OK, 5 rows affected (0.30 sec)
Records: 5  Duplicates: 0  Warnings: 0

Select * from Account
+--------+-------------+---------+
| Acc_no | branch_name | balance |
+--------+-------------+---------+
|    101 | Wakad       |   90000 |
|    102 | Akurdi      |   60000 |
|    103 | Nigdi       |   50000 |
|    104 | Ravet       |   70000 |
|    105 | Pimpri      |   80000 |
+--------+-------------+---------+
5 rows in set (0.04 sec)

-- Create Branch table
mysql> create table Branch(
    ->     branch_name varchar(10),
    ->     branch_city varchar(10),
    ->     assets int
    -> );
Query OK, 0 rows affected (0.83 sec)

-- Insert values into Branch table
mysql> insert into Branch(branch_name,branch_city,assets)
    -> values('Wakad','Pune',10000000),
    -> ('Akurdi','Pune',20000000),
    -> ('Nigdi','Pune',30000000),
    -> ('Ravet','Pune',40000000),
    -> ('Pimpri','Pune  ',1000000);
Query OK, 5 rows affected (0.30 sec)
Records: 5  Duplicates: 0  Warnings: 0 

SELECT * FROM Branch;
+-------------+-------------+----------+
| branch_name | branch_city | assets   |
+-------------+-------------+----------+
| Wakad       | Pune        | 10000000 |
| Akurdi      | Pune        | 20000000 |
| Nigdi       | Pune        | 30000000 |
| Ravet       | Pune        | 40000000 |
| Pimpri      | Pune        |  1000000 |
+-------------+-------------+----------+
5 rows in set (0.00 sec)

-- Create Customer table
mysql> create table Customer(
    ->     cust_name varchar(20),
    ->     cust_street varchar(20),
    ->     cust_city varchar(10) 
    -> ); 
Query OK, 0 rows affected (1.30 sec)

-- Insert values into Customer table
mysql> insert into Customer(cust_name,cust_street,cust_city)
    -> values('Alpha','Ravet','Pune'),
    -> ('Charlie','Nigdi','Pune'),
    -> ('Root','Nigdi','Pune'),
    -> ('Kernel','Wakad','Pune'),
    -> ('Kali','Akurdi','Pune');
Query OK, 5 rows affected (0.18 sec)
Records: 5  Duplicates: 0  Warnings: 0

mysql> Select * from Customer;
+-----------+-------------+-----------+
| cust_name | cust_street | cust_city |
+-----------+-------------+-----------+
| Alpha     | Ravet       | Pune      |
| Charlie   | Nigdi       | Pune      |
| Root      | Nigdi       | Pune      |
| Kernel    | Wakad       | Pune      |
| Kali      | Akurdi      | Pune      |
+-----------+-------------+-----------+
5 rows in set (0.00 sec)

-- Create Depositor table
mysql> create table Depositor(
    ->     cust_name varchar(20),
    ->     acc_no int 
    -> );
Query OK, 0 rows affected (1.74 sec)

-- Insert values into Depositor table
mysql> insert into Depositor(cust_name,acc_no)
    -> values('Alpha',101),
    -> ('Charlie',102),
    -> ('Root',103),
    -> ('Kernel',104),
    -> ('Kali',105);
Query OK, 5 rows affected (0.15 sec)
Records: 5  Duplicates: 0  Warnings: 0

mysql> Select * from Depositor;
+-----------+--------+
| cust_name | acc_no |
+-----------+--------+
| Alpha     |    101 |
| Charlie   |    102 |
| Root      |    103 |
| Kernel    |    104 |
| Kali      |    105 |
+-----------+--------+
5 rows in set (0.00 sec)

-- Create Loan table
mysql> create table Loan(
    ->     loan_no int, 
    ->     branch_name varchar(10), 
    ->     amount int 
    -> );
Query OK, 0 rows affected (1.29 sec)

-- Insert values into Loan table
mysql> insert into Loan(loan_no,branch_name,amount)
    -> values(201,'Wakad',50000),
    -> (202,'Akurdi',40000),
    -> (203,'Nigdi',1400),
    -> (204,'Ravet ',60000),
    -> (205,'Pimpri',70000);
Query OK, 5 rows affected (0.13 sec)
Records: 5  Duplicates: 0  Warnings: 0

mysql> Select * from Loan;
+---------+-------------+--------+
| loan_no | branch_name | amount |
+---------+-------------+--------+
|     201 | Wakad       |  50000 |
|     202 | Akurdi      |  40000 |
|     203 | Nigdi       |   1400 |
|     204 | Ravet       |  60000 |
|     205 | Pimpri      |  70000 |
+---------+-------------+--------+
5 rows in set (0.00 sec)

-- Create Borrower table
mysql> create table Borrower( 
    ->     cust_name varchar(20), 
    ->     loan_no int
    -> );
Query OK, 0 rows affected (0.59 sec)

-- Insert values into Borrower table
mysql> insert into Borrower(cust_name,loan_no)
    -> values('Alpha',201),
    -> ('Charlie',202),
    -> ('Root',203),
    -> ('Kernel',204),
    -> ('Kali',205);
Query OK, 5 rows affected (0.12 sec)
Records: 5  Duplicates: 0  Warnings: 0

mysql> select * from Borrower;
+-----------+---------+
| cust_name | loan_no |
+-----------+---------+
| Alpha     |     201 |
| Charlie   |     202 |
| Root      |     203 |
| Kernel    |     204 |
| Kali      |     205 |
+-----------+---------+
5 rows in set (0.00 sec)

-- These are the required tables, now we will perform actual operations on these tables and observe the changes
-- These questions were given by our faculty and these may differ in your case

--1 
mysql> select branch_name from Loan;
+-------------+
| branch_name |
+-------------+
| Wakad       |
| Akurdi      |
| Nigdi       |
| Ravet       |
| Pimpri      |
+-------------+
5 rows in set (0.00 sec)

--2
mysql> select loan_no from Loan where branch_name="Akurdi" and amount>12000;
+---------+
| loan_no |
+---------+
|     202 |
+---------+
1 row in set (0.00 sec)

--3
mysql> select Borrower.loan_no, cust_name,amount from Borrower, Loan 
    -> where Borrower.loan_no=Loan.loan_no;
+---------+-----------+--------+
| loan_no | cust_name | amount |
+---------+-----------+--------+
|     201 | Alpha     |  50000 |
|     202 | Charlie   |  40000 |
|     203 | Root      |   1400 |
|     204 | Kernel    |  60000 |
|     205 | Kali      |  70000 |
+---------+-----------+--------+
5 rows in set (0.00 sec)

--4
mysql> select distinct cust_name from Borrower, Loan
    -> where Borrower.loan_no = Loan.loan_no and branch_name="Akurdi"
    -> order by cust_name;
+-----------+
| cust_name |
+-----------+
| Charlie   |
+-----------+
1 row in set (0.10 sec)

--5
mysql> (select cust_name from Depositor) union (select cust_name from Borrower); 
+-----------+
| cust_name |
+-----------+
| Alpha     |
| Charlie   |
| Root      |
| Kernel    |
| Kali      |
+-----------+
5 rows in set (0.05 sec)

--6
mysql> select distinct cust_name from Borrower
    -> where cust_name in (select cust_name from Depositor);
+-----------+
| cust_name |
+-----------+
| Alpha     |
| Charlie   |
| Root      |
| Kernel    |
| Kali      |
+-----------+
5 rows in set (0.02 sec)


--7
mysql> select cust_name from Depositor
    -> where cust_name not in (select cust_name from Borrower);
Empty set (0.06 sec)


--8
mysql> select avg(balance) from Account where branch_name="Akurdi";
+--------------+
| avg(balance) |
+--------------+
|   60000.0000 |
+--------------+
1 row in set (0.06 sec)

--9
mysql> select branch_name, avg(balance) from Account group by branch_name;
+-------------+--------------+
| branch_name | avg(balance) |
+-------------+--------------+
| Wakad       |   90000.0000 |
| Akurdi      |   60000.0000 |
| Nigdi       |   50000.0000 |
| Ravet       |   70000.0000 |
| Pimpri      |   80000.0000 |
+-------------+--------------+
5 rows in set (0.04 sec)

--10
mysql> select branch_name, avg (balance) from Account group by branch_name having avg(balance)>12000;
+-------------+---------------+
| branch_name | avg (balance) |
+-------------+---------------+
| Wakad       |    90000.0000 |
| Akurdi      |    60000.0000 |
| Nigdi       |    50000.0000 |
| Ravet       |    70000.0000 |
| Pimpri      |    80000.0000 |
+-------------+---------------+
5 rows in set (0.04 sec)

--11
mysql> select sum(amount) from Loan;
+-------------+
| sum(amount) |
+-------------+
|      221400 |
+-------------+
1 row in set (0.00 sec)

--12
mysql> delete from Loan where amount between 1300 and 1500;
Query OK, 1 row affected (0.25 sec)
mysql> select * from Loan;
+---------+-------------+--------+
| loan_no | branch_name | amount |
+---------+-------------+--------+
|     201 | Wakad       |  50000 |
|     202 | Akurdi      |  40000 |
|     204 | Ravet       |  60000 |
|     205 | Pimpri      |  70000 |
+---------+-------------+--------+
4 rows in set (0.00 sec)
